,alternateCandidates,mandates,party,presidents,votes.absoluteMajority,votes.constituenctyCounter,votes.mandates,votes.percentage,votes.presidents,votes.votes,county,district,availableMandates,blankVotes,blankVotesPercentage,displayMessage,hasNoVoting,nullVotes,nullVotesPercentage,numberParishes,numberVoters,percentageVoters,candidatos,year
0,,0,B.E.,0,0,1,0,1.67,0,226,Albergaria-a-Velha,Aveiro,0,218,1.61,,False,149,1.1,8,13508,60.92,Américo Bastos Rodrigues da Silva,2009
1,,2,CDS-PP,0,0,1,2,32.37,0,4373,Albergaria-a-Velha,Aveiro,0,218,1.61,,False,149,1.1,8,13508,60.92,António Augusto Amaral Loureiro e Santos,2009
2,,0,PCP-PEV,0,0,1,0,1.84,0,248,Albergaria-a-Velha,Aveiro,0,218,1.61,,False,149,1.1,8,13508,60.92,Bruno Miguel Alves Bento,2009
3,,4,PPD/PSD,1,1,1,4,47.86,1,6465,Albergaria-a-Velha,Aveiro,0,218,1.61,,False,149,1.1,8,13508,60.92,João Agostinho Pinto Pereira,2009
4,,1,PS,0,0,1,1,13.54,0,1829,Albergaria-a-Velha,Aveiro,0,218,1.61,,False,149,1.1,8,13508,60.92,Jesus Manuel Vidinha Tomás,2009
5,,0,CDS-PP,0,0,1,0,9.32,0,1545,Anadia,Aveiro,0,397,2.4,,False,211,1.27,15,16569,57.39,Maria do Céu Anjos Simões H. Castelo-Branco,2009
6,,0,PCP-PEV,0,0,1,0,4.84,0,802,Anadia,Aveiro,0,397,2.4,,False,211,1.27,15,16569,57.39,José Francisco Paixão Correia,2009
7,,5,PPD/PSD,1,1,1,5,57.02,1,9448,Anadia,Aveiro,0,397,2.4,,False,211,1.27,15,16569,57.39,Litério Augusto Marques,2009
8,,2,PS,0,0,1,2,25.14,0,4166,Anadia,Aveiro,0,397,2.4,,False,211,1.27,15,16569,57.39,Lino Jorge Cerveira Pintado,2009
9,,0,CDS-PP,0,0,1,0,9.65,0,1482,Arouca,Aveiro,0,209,1.36,,False,234,1.52,20,15354,71.64,José Maria Costa Gomes,2009
10,,0,II,0,0,1,0,7.59,0,1166,Arouca,Aveiro,0,209,1.36,,False,234,1.52,20,15354,71.64,Vítor Fernando Gomes Brandão,2009
11,,0,PCP-PEV,0,0,1,0,1.67,0,256,Arouca,Aveiro,0,209,1.36,,False,234,1.52,20,15354,71.64,Francisco Manuel da Cunha Gonçalves,2009
12,,2,PPD/PSD,0,0,1,2,19.68,0,3022,Arouca,Aveiro,0,209,1.36,,False,234,1.52,20,15354,71.64,Manuel Artur de Almeida Miler,2009
13,,5,PS,1,1,1,5,58.52,1,8985,Arouca,Aveiro,0,209,1.36,,False,234,1.52,20,15354,71.64,José Artur Tavares Neves,2009
14,,0,B.E.,0,0,1,0,5.07,0,1814,Aveiro,Aveiro,0,1067,2.98,,False,489,1.37,14,35773,53.08,Catarina Sofia Esteves Antunes Morais Gomes,2009
15,,0,PCP-PEV,0,0,1,0,3.66,0,1311,Aveiro,Aveiro,0,1067,2.98,,False,489,1.37,14,35773,53.08,António Manuel Brito Moreira,2009
16,,6,PPD/PSD.CDS-PP,1,1,1,6,53.79,1,19243,Aveiro,Aveiro,0,1067,2.98,,False,489,1.37,14,35773,53.08,Élio Manuel Delgado da Maia,2009
17,,3,PS,0,0,1,3,33.12,0,11849,Aveiro,Aveiro,0,1067,2.98,,False,489,1.37,14,35773,53.08,José da Cruz Costa,2009
18,,0,B.E.,0,0,1,0,1.24,0,146,Castelo de Paiva,Aveiro,0,98,0.83,,False,118,1.0,9,11779,78.67,Bruno Sérgio Gomes Soares,2009
19,,0,CDS-PP,0,0,1,0,2.72,0,320,Castelo de Paiva,Aveiro,0,98,0.83,,False,118,1.0,9,11779,78.67,Paulo Fernando Nogueira Martel da Silva,2009
20,,0,PCP-PEV,0,0,1,0,0.82,0,97,Castelo de Paiva,Aveiro,0,98,0.83,,False,118,1.0,9,11779,78.67,Manuel da Rocha Vieira,2009
21,,3,PPD/PSD,0,0,1,3,46.66,0,5496,Castelo de Paiva,Aveiro,0,98,0.83,,False,118,1.0,9,11779,78.67,Paulo Ramalheira Teixeira,2009
22,,4,PS,1,1,1,4,46.73,1,5504,Castelo de Paiva,Aveiro,0,98,0.83,,False,118,1.0,9,11779,78.67,Gonçalo Fernando da Rocha de Jesus,2009
23,,0,B.E.,0,0,1,0,3.43,0,710,Espinho,Aveiro,0,444,2.14,,False,263,1.27,5,20708,65.65,Carlos Alberto Silva,2009
24,,0,CDS-PP,0,0,1,0,9.19,0,1903,Espinho,Aveiro,0,444,2.14,,False,263,1.27,5,20708,65.65,Marques Baptista,2009
25,,0,PCP-PEV,0,0,1,0,6.55,0,1356,Espinho,Aveiro,0,444,2.14,,False,263,1.27,5,20708,65.65,Fausto Neves,2009
26,,4,PPD/PSD,1,1,1,4,39.11,1,8099,Espinho,Aveiro,0,444,2.14,,False,263,1.27,5,20708,65.65,Pinto Moreira,2009
27,,3,PS,0,0,1,3,38.31,0,7933,Espinho,Aveiro,0,444,2.14,,False,263,1.27,5,20708,65.65,José Mota,2009
28,,0,PCP-PEV,0,0,1,0,4.36,0,617,Estarreja,Aveiro,0,232,1.64,,False,187,1.32,7,14160,56.33,António Manuel de Figueiredo Vidal,2009
29,,5,PPD/PSD.CDS-PP,1,1,1,5,64.15,1,9083,Estarreja,Aveiro,0,232,1.64,,False,187,1.32,7,14160,56.33,José Eduardo Alves Valente de Matos,2009
30,,2,PS,0,0,1,2,28.54,0,4041,Estarreja,Aveiro,0,232,1.64,,False,187,1.32,7,14160,56.33,Fernando Manuel Mendonça Albergaria Matos,2009
31,,5,PS,1,1,1,5,61.26,1,6517,Mealhada,Aveiro,0,311,2.92,,False,149,1.4,8,10639,57.29,Carlos Alberto da Costa Cabral,2009
32,,0,CDS-PP,0,0,1,0,2.18,0,112,Murtosa,Aveiro,0,83,1.62,,False,63,1.23,4,5133,52.15,Ana Sofia Ribeiro Brandão,2009
33,,0,PCP-PEV,0,0,1,0,1.62,0,83,Murtosa,Aveiro,0,83,1.62,,False,63,1.23,4,5133,52.15,Jorge Augusto Portela Vieira,2009
34,,4,PPD/PSD,1,1,1,4,66.3,1,3403,Murtosa,Aveiro,0,83,1.62,,False,63,1.23,4,5133,52.15,António Maria dos Santos Sousa,2009
35,,1,PS,0,0,1,1,27.06,0,1389,Murtosa,Aveiro,0,83,1.62,,False,63,1.23,4,5133,52.15,Ana Maria Farelo Mendes Silva Rebimbas,2009
36,,0,B.E.,0,0,1,0,2.39,0,938,Oliveira de Azeméis,Aveiro,0,700,1.78,,False,463,1.18,19,39239,64.39,Cláudia Patrícia de Pinho Ribeiro,2009
37,,0,CDS-PP,0,0,1,0,7.46,0,2928,Oliveira de Azeméis,Aveiro,0,700,1.78,,False,463,1.18,19,39239,64.39,António Pinto Moreira,2009
38,,0,PCP-PEV,0,0,1,0,1.79,0,703,Oliveira de Azeméis,Aveiro,0,700,1.78,,False,463,1.18,19,39239,64.39,António Costa Alves,2009
39,,5,PPD/PSD,1,1,1,5,44.83,1,17590,Oliveira de Azeméis,Aveiro,0,700,1.78,,False,463,1.18,19,39239,64.39,Hermínio José Sobral de Loureiro Gonçalves,2009
40,,4,PS,0,0,1,4,40.56,0,15917,Oliveira de Azeméis,Aveiro,0,700,1.78,,False,463,1.18,19,39239,64.39,Maria Helena Terra de Oliveira,2009
41,,2,CDS-PP,0,0,1,2,31.49,0,3658,Oliveira do Bairro,Aveiro,0,179,1.54,,False,166,1.43,6,11615,58.01,Acílio Domingues Gala,2009
42,,0,PCP-PEV,0,0,1,0,1.22,0,142,Oliveira do Bairro,Aveiro,0,179,1.54,,False,166,1.43,6,11615,58.01,Artur Pereira Ramísio,2009
43,,4,PPD/PSD,1,1,1,4,53.58,1,6223,Oliveira do Bairro,Aveiro,0,179,1.54,,False,166,1.43,6,11615,58.01,Mário João Ferreira da Silva Oliveira,2009
44,,1,PS,0,0,1,1,10.74,0,1247,Oliveira do Bairro,Aveiro,0,179,1.54,,False,166,1.43,6,11615,58.01,Henrique Santiago Tomás,2009
45,,0,B.E.,0,0,1,0,9.4,0,2657,Ovar,Aveiro,0,605,2.14,,False,368,1.3,8,28252,58.79,José David Mendes de Almeida,2009
46,,0,PCP-PEV,0,0,1,0,4.86,0,1373,Ovar,Aveiro,0,605,2.14,,False,368,1.3,8,28252,58.79,José dos Santos Cardoso Macedo,2009
47,,3,PPD/PSD.CDS-PP,0,0,1,3,33.31,0,9412,Ovar,Aveiro,0,605,2.14,,False,368,1.3,8,28252,58.79,Álvaro Manuel Reis Santos,2009
48,,4,PS,1,1,1,4,48.98,1,13837,Ovar,Aveiro,0,605,2.14,,False,368,1.3,8,28252,58.79,Manuel Alves de Oliveira,2009
49,,0,B.E.,0,0,1,0,2.59,0,2049,Santa Maria da Feira,Aveiro,0,1351,1.71,,False,787,1.0,31,79075,65.02,Joaquim Manuel de Oliveira Dias,2009
50,,0,CDS-PP,0,0,1,0,3.5,0,2767,Santa Maria da Feira,Aveiro,0,1351,1.71,,False,787,1.0,31,79075,65.02,Manuel José Alferes Pereira,2009
51,,0,PCP-PEV,0,0,1,0,2.52,0,1995,Santa Maria da Feira,Aveiro,0,1351,1.71,,False,787,1.0,31,79075,65.02,Antero de Oliveira Resende,2009
52,,6,PPD/PSD,1,1,1,6,48.07,1,38008,Santa Maria da Feira,Aveiro,0,1351,1.71,,False,787,1.0,31,79075,65.02,Alfredo Oliveira Henriques,2009
53,,5,PS,0,0,1,5,40.62,0,32118,Santa Maria da Feira,Aveiro,0,1351,1.71,,False,787,1.0,31,79075,65.02,Alcides Alves Branco de Carvalho,2009
54,,0,CDS-PP,0,0,1,0,3.71,0,314,Sever do Vouga,Aveiro,0,120,1.42,,False,93,1.1,9,8456,69.57,António José Cardoso de Barros,2009
55,,2,IV,0,0,1,2,25.66,0,2170,Sever do Vouga,Aveiro,0,120,1.42,,False,93,1.1,9,8456,69.57,João Miguel Tavares de Almeida,2009
56,,0,PCP-PEV,0,0,1,0,1.36,0,115,Sever do Vouga,Aveiro,0,120,1.42,,False,93,1.1,9,8456,69.57,António José Tavares de Bastos,2009
57,,1,PPD/PSD,0,0,1,1,20.16,0,1705,Sever do Vouga,Aveiro,0,120,1.42,,False,93,1.1,9,8456,69.57,Acácio Rodrigues Barbosa,2009
58,,4,PS,1,1,1,4,46.58,1,3939,Sever do Vouga,Aveiro,0,120,1.42,,False,93,1.1,9,8456,69.57,Manuel Silva Soares,2009
59,,0,B.E.,0,0,1,0,2.66,0,310,São João da Madeira,Aveiro,0,144,1.24,,False,99,0.85,1,11658,58.35,Pedro da Costa Pardal,2009
60,,0,CDS-PP,0,0,1,0,7.15,0,833,São João da Madeira,Aveiro,0,144,1.24,,False,99,0.85,1,11658,58.35,Dina Maria da Costa de Pinho Rocha,2009
61,,0,PCP-PEV,0,0,1,0,5.76,0,672,São João da Madeira,Aveiro,0,144,1.24,,False,99,0.85,1,11658,58.35,Jorge Manuel de Resende Cortez,2009
62,,5,PPD/PSD,1,1,1,5,55.95,1,6523,São João da Madeira,Aveiro,0,144,1.24,,False,99,0.85,1,11658,58.35,Manuel Castro de Almeida,2009
63,,2,PS,0,0,1,2,26.39,0,3077,São João da Madeira,Aveiro,0,144,1.24,,False,99,0.85,1,11658,58.35,Pedro Nuno de Oliveira Santos,2009
64,,0,PCP-PEV,0,0,1,0,2.25,0,274,Vagos,Aveiro,0,202,1.66,,False,205,1.68,11,12186,57.33,Manuel Mário Domingos,2009
65,,5,PPD/PSD,1,1,1,5,63.42,1,7728,Vagos,Aveiro,0,202,1.66,,False,205,1.68,11,12186,57.33,Rui Miguel Rocha da Cruz,2009
66,,2,X,0,0,1,2,30.99,0,3777,Vagos,Aveiro,0,202,1.66,,False,205,1.68,11,12186,57.33,Mário dos Santos Martins Júnior,2009
67,,3,CDS-PP,0,0,1,3,37.59,0,5652,Vale de Cambra,Aveiro,0,250,1.66,,False,245,1.63,9,15034,66.31,José Alberto Freitas Soares Pinheiro e Silva,2009
68,,0,PCP-PEV,0,0,1,0,2.19,0,329,Vale de Cambra,Aveiro,0,250,1.66,,False,245,1.63,9,15034,66.31,João Pedro Tavares Martins,2009
69,,4,PPD/PSD,1,1,1,4,46.17,1,6941,Vale de Cambra,Aveiro,0,250,1.66,,False,245,1.63,9,15034,66.31,José António Bastos da Silva,2009
70,,0,PS,0,0,1,0,10.76,0,1617,Vale de Cambra,Aveiro,0,250,1.66,,False,245,1.63,9,15034,66.31,Carlos Gabriel Almeida Amorim,2009
71,,0,B.E.,0,0,1,0,1.28,0,342,Águeda,Aveiro,0,454,1.7,,False,253,0.95,20,26741,60.96,Vítor Manuel Aguiar Gomes,2009
72,,0,CDS-PP,0,0,1,0,5.16,0,1379,Águeda,Aveiro,0,454,1.7,,False,253,0.95,20,26741,60.96,José Carlos Esmeraldo dos Santos,2009
73,,0,PCP-PEV,0,0,1,0,1.9,0,509,Águeda,Aveiro,0,454,1.7,,False,253,0.95,20,26741,60.96,Nelson Manuel Nunes Leal,2009
74,,0,PND,0,0,1,0,0.39,0,105,Águeda,Aveiro,0,454,1.7,,False,253,0.95,20,26741,60.96,Alexandra Isabel Ferreira Abrantes,2009
75,,3,PPD/PSD,0,0,1,3,34.14,0,9130,Águeda,Aveiro,0,454,1.7,,False,253,0.95,20,26741,60.96,Manuel de Castro Azevedo,2009
76,,4,PS,1,1,1,4,54.48,1,14569,Águeda,Aveiro,0,454,1.7,,False,253,0.95,20,26741,60.96,Gil Nadais Resende da Fonseca,2009
77,,0,B.E.,0,0,1,0,2.6,0,418,Ílhavo,Aveiro,0,318,1.97,,False,153,0.95,4,16107,47.55,José Paulo Alves Corceiro,2009
78,,0,CDS-PP,0,0,1,0,5.22,0,841,Ílhavo,Aveiro,0,318,1.97,,False,153,0.95,4,16107,47.55,Francisco Luís Pereira da Rocha,2009
79,,0,PCP-PEV,0,0,1,0,3.04,0,490,Ílhavo,Aveiro,0,318,1.97,,False,153,0.95,4,16107,47.55,Fernando José de Jesus Marta,2009
80,,5,PPD/PSD,1,1,1,5,63.53,1,10233,Ílhavo,Aveiro,0,318,1.97,,False,153,0.95,4,16107,47.55,José Agostinho Ribau Esteves,2009
81,,2,PS,0,0,1,2,22.69,0,3654,Ílhavo,Aveiro,0,318,1.97,,False,153,0.95,4,16107,47.55,José Marinho Vaz,2009
82,,0,B.E.,0,0,1,0,1.69,0,303,Angra do Heroísmo,Açores,0,237,1.32,,False,137,0.76,19,17951,56.14,Orlando Manuel Labrusco Félix Guerreiro,2009
83,,1,CDS-PP,0,0,1,1,13.81,0,2479,Angra do Heroísmo,Açores,0,237,1.32,,False,137,0.76,19,17951,56.14,Artur Manuel Leal Lima,2009
84,,0,PCP-PEV,0,0,1,0,1.07,0,192,Angra do Heroísmo,Açores,0,237,1.32,,False,137,0.76,19,17951,56.14,António Gabriel Botelho da Fonseca,2009
85,,3,PPD/PSD,0,0,1,3,35.76,0,6419,Angra do Heroísmo,Açores,0,237,1.32,,False,137,0.76,19,17951,56.14,António Lima Cardoso Ventura,2009
86,,3,PS,1,0,1,3,45.59,1,8184,Angra do Heroísmo,Açores,0,237,1.32,,False,137,0.76,19,17951,56.14,Andreia Martins Cardoso da Costa,2009
87,,3,PPD/PSD,1,1,1,3,52.18,1,1378,Calheta (R.A.A.),Açores,0,37,1.4,,False,19,0.72,5,2641,69.66,Aires António Fagundes Reis,2009
88,,2,PS,0,0,1,2,45.7,0,1207,Calheta (R.A.A.),Açores,0,37,1.4,,False,19,0.72,5,2641,69.66,Rogério Paulo Lopes Soares Veiros,2009
89,,1,PPD/PSD,0,0,1,1,31.41,0,87,Corvo,Açores,0,5,1.81,,False,5,1.81,1,277,78.69,Deolinda Rosa Machado Vieira Estevão,2009
90,,4,PS,1,1,1,4,64.98,1,180,Corvo,Açores,0,5,1.81,,False,5,1.81,1,277,78.69,Manuel das Pedras Rita,2009
91,,0,B.E.,0,0,1,0,1.45,0,123,Horta,Açores,0,139,1.64,,False,60,0.71,13,8487,65.06,Maria José Ferreira da Silva,2009
92,,0,CDS-PP,0,0,1,0,1.24,0,105,Horta,Açores,0,139,1.64,,False,60,0.71,13,8487,65.06,Alexandre Agostinho Martins de Carvalho,2009
93,,0,PCP-PEV,0,0,1,0,9.18,0,779,Horta,Açores,0,139,1.64,,False,60,0.71,13,8487,65.06,José Eduardo Bicudo Decq Mota,2009
94,,3,PPD/PSD,0,0,1,3,40.62,0,3447,Horta,Açores,0,139,1.64,,False,60,0.71,13,8487,65.06,Paulo Jorge Peixinho de Oliveira,2009
95,,4,PS,1,1,1,4,45.17,1,3834,Horta,Açores,0,139,1.64,,False,60,0.71,13,8487,65.06,João Fernando Brum de Azevedo e Castro,2009
96,,0,CDS-PP,0,0,1,0,3.84,0,230,Lagoa (R.A.A),Açores,0,82,1.37,,False,104,1.73,5,5996,49.81,Roberto Manuel Sousa Oliveira,2009
97,,0,PCP-PEV,0,0,1,0,1.3,0,78,Lagoa (R.A.A),Açores,0,82,1.37,,False,104,1.73,5,5996,49.81,Júlio Manuel Pereira Duarte,2009
98,,2,PPD/PSD,0,0,1,2,25.4,0,1523,Lagoa (R.A.A),Açores,0,82,1.37,,False,104,1.73,5,5996,49.81,Rui Manuel Maciel Costa de Oliveira Ramos,2009
99,,5,PS,1,1,1,5,66.36,1,3979,Lagoa (R.A.A),Açores,0,82,1.37,,False,104,1.73,5,5996,49.81,João António Ferreira Ponte,2009
100,,3,PPD/PSD,1,1,1,3,53.86,1,558,Lajes das Flores,Açores,0,8,0.77,,False,5,0.48,7,1036,80.94,João António Vieira Lourenço,2009
101,,2,PS,0,0,1,2,44.88,0,465,Lajes das Flores,Açores,0,8,0.77,,False,5,0.48,7,1036,80.94,Luís Carlos Martins Maciel,2009
102,,2,PPD/PSD,0,0,1,2,47.75,0,1592,Lajes do Pico,Açores,0,30,0.9,,False,28,0.84,6,3334,74.89,Sara Maria Alves da Rosa Santos,2009
103,,3,PS,1,1,1,3,50.51,1,1684,Lajes do Pico,Açores,0,30,0.9,,False,28,0.84,6,3334,74.89,Roberto Manuel Medeiros da Silva,2009
104,,0,PCP-PEV,0,0,1,0,2.08,0,76,Madalena,Açores,0,75,2.05,,False,20,0.55,6,3650,69.08,Elisabete da Piedade Alves,2009
105,,4,PPD/PSD,1,1,1,4,64.14,1,2341,Madalena,Açores,0,75,2.05,,False,20,0.55,6,3650,69.08,Jorge Manuel Pereira Rodrigues,2009
106,,1,PS,0,0,1,1,31.18,0,1138,Madalena,Açores,0,75,2.05,,False,20,0.55,6,3650,69.08,Hernani Hélio Jorge,2009
107,,3,PPD/PSD,1,1,1,3,56.5,1,1965,Nordeste,Açores,0,61,1.75,,False,60,1.73,9,3478,74.06,José Carlos Barbosa Carreiro,2009
108,,2,PS,0,0,1,2,40.02,0,1392,Nordeste,Açores,0,61,1.75,,False,60,1.73,9,3478,74.06,Carlos Alberto Medeiros Mendonça,2009
109,,0,B.E.,0,0,1,0,2.09,0,599,Ponta Delgada,Açores,0,290,1.01,,False,219,0.76,24,28702,47.27,Lúcia de Fátima Oliveira Arruda,2009
110,,0,CDS-PP,0,0,1,0,2.76,0,792,Ponta Delgada,Açores,0,290,1.01,,False,219,0.76,24,28702,47.27,Eduardo Jorge Lopes Medeiros,2009
111,,0,PCP-PEV,0,0,1,0,1.67,0,480,Ponta Delgada,Açores,0,290,1.01,,False,219,0.76,24,28702,47.27,Carlos Alberto Gomes Ribeiro,2009
112,,6,PPD/PSD,1,1,1,6,60.69,1,17419,Ponta Delgada,Açores,0,290,1.01,,False,219,0.76,24,28702,47.27,Berta Maria Correia de Almeida de Melo Cabral,2009
113,,3,PS,0,0,1,3,31.02,0,8903,Ponta Delgada,Açores,0,290,1.01,,False,219,0.76,24,28702,47.27,José Paulo Martins Casaca,2009
114,,0,PCP-PEV,0,0,1,0,0.74,0,32,Povoação,Açores,0,56,1.3,,False,39,0.91,6,4304,69.37,Teresa de Jesus Vieira Moniz Vertentes,2009
115,,2,PPD/PSD,0,0,1,2,39.8,0,1713,Povoação,Açores,0,56,1.3,,False,39,0.91,6,4304,69.37,Francisco da Silva Álvares,2009
116,,3,PS,1,1,1,3,57.25,1,2464,Povoação,Açores,0,56,1.3,,False,39,0.91,6,4304,69.37,Carlos Emílio Lopes Machado Ávila,2009
117,,0,CDS-PP,0,0,1,0,2.02,0,272,Ribeira Grande,Açores,0,158,1.17,,False,163,1.21,14,13479,53.13,Artur José Araújo de Arruda Ponte,2009
118,,0,PCP-PEV,0,0,1,0,1.51,0,203,Ribeira Grande,Açores,0,158,1.17,,False,163,1.21,14,13479,53.13,Antero Jerónimo Moniz Arruda Quental,2009
119,,3,PPD/PSD,0,0,1,3,36.09,0,4864,Ribeira Grande,Açores,0,158,1.17,,False,163,1.21,14,13479,53.13,Filomeno dos Anjos da Silva Gouveia,2009
120,,4,PS,1,1,1,4,54.54,1,7352,Ribeira Grande,Açores,0,158,1.17,,False,163,1.21,14,13479,53.13,Ricardo José Moniz da Silva,2009
121,,2,PPD/PSD,0,0,1,2,45.26,0,1288,Santa Cruz da Graciosa,Açores,0,35,1.23,,False,29,1.02,4,2846,66.5,José Ramos de Aguiar,2009
122,,3,PS,1,1,1,3,52.49,1,1494,Santa Cruz da Graciosa,Açores,0,35,1.23,,False,29,1.02,4,2846,66.5,Manuel Avelar Cunha Santos,2009
123,,0,CDS-PP,0,0,1,0,13.21,0,184,Santa Cruz das Flores,Açores,0,22,1.58,,False,6,0.43,4,1393,69.51,Rosa Margarida Ribeiro Cravinho,2009
124,,0,PCP-PEV,0,0,1,0,5.81,0,81,Santa Cruz das Flores,Açores,0,22,1.58,,False,6,0.43,4,1393,69.51,João Paulo Valadão Corvelo,2009
125,,1,PPD/PSD,0,0,1,1,22.61,0,315,Santa Cruz das Flores,Açores,0,22,1.58,,False,6,0.43,4,1393,69.51,Hélio Fernando Miranda Ramos,2009
126,,4,PS,1,1,1,4,56.35,1,785,Santa Cruz das Flores,Açores,0,22,1.58,,False,6,0.43,4,1393,69.51,Manuel Alberto da Silva Pereira,2009
127,,0,CDS-PP,0,0,1,0,1.05,0,24,São Roque do Pico,Açores,0,29,1.27,,False,16,0.7,5,2292,71.54,Rosa Maria da Silva Vieira,2009
128,,0,PCP-PEV,0,0,1,0,0.61,0,14,São Roque do Pico,Açores,0,29,1.27,,False,16,0.7,5,2292,71.54,José Manuel Bettencourt Ávila,2009
129,,3,PPD/PSD,1,1,1,3,56.37,1,1292,São Roque do Pico,Açores,0,29,1.27,,False,16,0.7,5,2292,71.54,Luís Filipe Ramos Macedo da Silva,2009
130,,2,PS,0,0,1,2,40.01,0,917,São Roque do Pico,Açores,0,29,1.27,,False,16,0.7,5,2292,71.54,Paulo Jaime Terra Goulart,2009
131,,0,B.E.,0,0,1,0,0.59,0,21,Velas,Açores,0,49,1.39,,False,38,1.08,6,3533,70.07,António Fernando Cardoso,2009
132,,0,CDS-PP,0,0,1,0,11.29,0,399,Velas,Açores,0,49,1.39,,False,38,1.08,6,3533,70.07,Vítor Manuel Assunção Bernardes,2009
133,,2,PPD/PSD,0,0,1,2,35.55,0,1256,Velas,Açores,0,49,1.39,,False,38,1.08,6,3533,70.07,António José Bettencourt da Silveira,2009
134,,3,PS,1,1,1,3,50.1,1,1770,Velas,Açores,0,49,1.39,,False,38,1.08,6,3533,70.07,Manuel Soares da Silveira,2009
135,,0,CDS-PP,0,0,1,0,3.8,0,244,Vila Franca do Campo,Açores,0,63,0.98,,False,115,1.79,6,6422,65.22,João Manuel Pacheco Furtado,2009
136,,0,PCP-PEV,0,0,1,0,0.59,0,38,Vila Franca do Campo,Açores,0,63,0.98,,False,115,1.79,6,6422,65.22,Juvenálio dos Santos da Ponte,2009
137,,2,PPD/PSD,0,0,1,2,34.79,0,2234,Vila Franca do Campo,Açores,0,63,0.98,,False,115,1.79,6,6422,65.22,Rui António Dias da Câmara de Carvalho e Melo,2009
138,,3,PS,1,1,1,3,58.05,1,3728,Vila Franca do Campo,Açores,0,63,0.98,,False,115,1.79,6,6422,65.22,António Fernando Raposo Cordeiro,2009
139,,0,B.E.,0,0,1,0,0.88,0,92,Vila da Praia da Vitória,Açores,0,123,1.17,,False,89,0.85,11,10509,55.95,Paulo José Maio Sousa Mendes,2009
140,,0,CDS-PP,0,0,1,0,3.77,0,396,Vila da Praia da Vitória,Açores,0,123,1.17,,False,89,0.85,11,10509,55.95,Pedro Gabriel Correia Nunes Teixeira Pinto,2009
141,,2,PPD/PSD,0,0,1,2,23.84,0,2505,Vila da Praia da Vitória,Açores,0,123,1.17,,False,89,0.85,11,10509,55.95,Berto Graciliano da Almeida Cabral,2009
142,,5,PS,1,1,1,5,69.5,1,7304,Vila da Praia da Vitória,Açores,0,123,1.17,,False,89,0.85,11,10509,55.95,Roberto Lúcio Silva Pereira Monteiro,2009
143,,0,CDS-PP,0,0,1,0,0.59,0,18,Vila do Porto,Açores,0,30,0.98,,False,32,1.04,5,3071,61.01,Maria Adelaide da Fonseca Ferreira Branco Morgado,2009
144,,0,PCP-PEV,0,0,1,0,4.62,0,142,Vila do Porto,Açores,0,30,0.98,,False,32,1.04,5,3071,61.01,Daniel da Silva Gonçalves,2009
145,,3,PPD/PSD,1,1,1,3,55.85,1,1715,Vila do Porto,Açores,0,30,0.98,,False,32,1.04,5,3071,61.01,Carlos Henrique Lopes Rodrigues,2009
146,,2,PS,0,0,1,2,36.93,0,1134,Vila do Porto,Açores,0,30,0.98,,False,32,1.04,5,3071,61.01,Nélia Maria Coutinho Figueiredo,2009
147,,2,PCP-PEV,0,0,1,2,46.79,0,2980,Aljustrel,Beja,0,86,1.35,,False,48,0.75,5,6369,69.39,Manuel Francisco Colaço Machado,2009
148,,0,PPD/PSD.CDS-PP,0,0,1,0,2.04,0,130,Aljustrel,Beja,0,86,1.35,,False,48,0.75,5,6369,69.39,Carlos Miguel Maia Palma Agatão,2009
149,,3,PS,1,1,1,3,49.07,1,3125,Aljustrel,Beja,0,86,1.35,,False,48,0.75,5,6369,69.39,Nelson Domingos Brito,2009
150,,0,B.E.,0,0,1,0,2.1,0,108,Almodôvar,Beja,0,90,1.75,,False,96,1.87,8,5135,69.19,Carlos Manuel da Palma Rosa,2009
151,,0,PCP-PEV,0,0,1,0,4.75,0,244,Almodôvar,Beja,0,90,1.75,,False,96,1.87,8,5135,69.19,Joaquim Augusto Loureiro Mariano,2009
152,,3,PPD/PSD,1,1,1,3,56.28,1,2890,Almodôvar,Beja,0,90,1.75,,False,96,1.87,8,5135,69.19,António José Messias do Rosário Sebastião,2009
153,,2,PS,0,0,1,2,33.24,0,1707,Almodôvar,Beja,0,90,1.75,,False,96,1.87,8,5135,69.19,João Manuel Luz Saleiro,2009
154,,2,PCP-PEV,1,0,1,2,34.08,1,547,Alvito,Beja,0,28,1.74,,False,19,1.18,2,1605,75.71,João Luís Batista Penetra,2009
155,,1,PPD/PSD.CDS-PP.PPM,0,0,1,1,29.6,0,475,Alvito,Beja,0,28,1.74,,False,19,1.18,2,1605,75.71,Mário Nelson da Silva Vaz Simões,2009
156,,2,PS,0,0,1,2,33.4,0,536,Alvito,Beja,0,28,1.74,,False,19,1.18,2,1605,75.71,Vicente Maria Mouzinho Maurício,2009
157,,0,CDS-PP,0,0,1,0,1.81,0,22,Barrancos,Beja,0,32,2.63,,False,25,2.05,1,1218,77.83,Sílvia Maria Ramalho Timóteo Vitorino,2009
158,,3,PCP-PEV,1,1,1,3,59.52,1,725,Barrancos,Beja,0,32,2.63,,False,25,2.05,1,1218,77.83,António Pica Tereno,2009
159,,2,PS,0,0,1,2,33.99,0,414,Barrancos,Beja,0,32,2.63,,False,25,2.05,1,1218,77.83,Francisco Manuel Canudo Sena,2009
160,,0,CDS-PP,0,0,1,0,1.59,0,298,Beja,Beja,0,214,1.14,,False,167,0.89,18,18758,60.67,Ismael António dos Santos Gomes Pimentel,2009
161,,3,PCP-PEV,0,0,1,3,41.66,0,7815,Beja,Beja,0,214,1.14,,False,167,0.89,18,18758,60.67,Francisco da Cruz dos Santos,2009
162,,0,PPD/PSD,0,0,1,0,4.98,0,935,Beja,Beja,0,214,1.14,,False,167,0.89,18,18758,60.67,José Filipe Pires dos Reis,2009
163,,4,PS,1,1,1,4,45.72,1,8577,Beja,Beja,0,214,1.14,,False,167,0.89,18,18758,60.67,Jorge Pulido Valente,2009
164,,0,VI,0,0,1,0,1.08,0,203,Beja,Beja,0,214,1.14,,False,167,0.89,18,18758,60.67,Dulce do Carmo Lopes Caleiro Amaral,2009
165,,3,PCP-PEV,1,1,1,3,54.97,1,2334,Castro Verde,Beja,0,58,1.37,,False,39,0.92,5,4246,64.09,Francisco José Caldeira Duarte,2009
166,,0,PPD/PSD.CDS-PP,0,0,1,0,4.55,0,193,Castro Verde,Beja,0,58,1.37,,False,39,0.92,5,4246,64.09,Pedro Daniel Ferreira de Castro Figueira,2009
167,,2,PS,0,0,1,2,38.2,0,1622,Castro Verde,Beja,0,58,1.37,,False,39,0.92,5,4246,64.09,José Francisco Colaço Guerreiro,2009
168,,2,PCP-PEV,0,0,1,2,46.17,0,1548,Cuba,Beja,0,37,1.1,,False,31,0.92,4,3353,80.52,João Manuel Casaca Português,2009
169,,0,PPD/PSD,0,0,1,0,3.64,0,122,Cuba,Beja,0,37,1.1,,False,31,0.92,4,3353,80.52,Maria da Conceição Gomes Pires,2009
170,,3,PS,1,1,1,3,48.17,1,1615,Cuba,Beja,0,37,1.1,,False,31,0.92,4,3353,80.52,Francisco António Galinha Orelha,2009
171,,0,MPT,0,0,1,0,1.62,0,83,Ferreira do Alentejo,Beja,0,78,1.52,,False,56,1.09,6,5116,65.61,Manuel Gonçalves,2009
172,,2,PCP-PEV,0,0,1,2,36.55,0,1870,Ferreira do Alentejo,Beja,0,78,1.52,,False,56,1.09,6,5116,65.61,Francisco António Braz Caixinha,2009
173,,0,PPD/PSD,0,0,1,0,3.3,0,169,Ferreira do Alentejo,Beja,0,78,1.52,,False,56,1.09,6,5116,65.61,Flora Maria Lança Mestrinho,2009
174,,3,PS,1,1,1,3,55.9,1,2860,Ferreira do Alentejo,Beja,0,78,1.52,,False,56,1.09,6,5116,65.61,Aníbal Sousa Reis Coelho da Costa,2009
175,,0,CDS-PP,0,0,1,0,2.1,0,164,Moura,Beja,0,195,2.5,,False,63,0.81,8,7797,54.95,Sílvia Perpétua Cruz Ramos,2009
176,,4,PCP-PEV,1,1,1,4,49.49,1,3859,Moura,Beja,0,195,2.5,,False,63,0.81,8,7797,54.95,José Maria Prazeres Pós-de-Mina,2009
177,,0,PPD/PSD,0,0,1,0,7.94,0,619,Moura,Beja,0,195,2.5,,False,63,0.81,8,7797,54.95,Simão Seita Janeiro,2009
178,,3,PS,0,0,1,3,37.16,0,2897,Moura,Beja,0,195,2.5,,False,63,0.81,8,7797,54.95,Rui Miguel Costa Apolinário,2009
179,,2,PCP-PEV,0,0,1,2,42.94,0,2456,Mértola,Beja,0,95,1.66,,False,93,1.63,9,5720,76.5,Jorge José Horta Revez,2009
180,,0,PPD/PSD,0,0,1,0,0.96,0,55,Mértola,Beja,0,95,1.66,,False,93,1.63,9,5720,76.5,José Diogo Morais dos Santos,2009
181,,3,PS,1,1,1,3,46.35,1,2651,Mértola,Beja,0,95,1.66,,False,93,1.63,9,5720,76.5,Jorge Paulo Colaço Rosa,2009
182,,0,XI,0,0,1,0,6.47,0,370,Mértola,Beja,0,95,1.66,,False,93,1.63,9,5720,76.5,José Carlos Raposo Rodrigues Celorico,2009
183,,0,B.E.,0,0,1,0,4.31,0,633,Odemira,Beja,0,313,2.13,,False,271,1.84,17,14695,66.18,Alberto Manuel Belo da Cunha Matos,2009
184,,3,PCP-PEV,0,0,1,3,34.39,0,5053,Odemira,Beja,0,313,2.13,,False,271,1.84,17,14695,66.18,Cláudio José dos Santos Percheiro,2009
185,,0,PPD/PSD.CDS-PP,0,0,1,0,10.77,0,1582,Odemira,Beja,0,313,2.13,,False,271,1.84,17,14695,66.18,José Francisco de Sousa Prado Santos Silva,2009
186,,4,PS,1,1,1,4,46.57,1,6843,Odemira,Beja,0,313,2.13,,False,271,1.84,17,14695,66.18,José Alberto Candeias Guerreiro,2009
187,,0,PCP-PEV,0,0,1,0,3.85,0,162,Ourique,Beja,0,51,1.21,,False,99,2.35,6,4210,81.12,António Custódio Coelho,2009
188,,1,PPD/PSD,0,0,1,1,25.94,0,1092,Ourique,Beja,0,51,1.21,,False,99,2.35,6,4210,81.12,José Raul Guerreiro Mendes dos Santos,2009
189,,4,PS,1,1,1,4,66.65,1,2806,Ourique,Beja,0,51,1.21,,False,99,2.35,6,4210,81.12,Pedro Nuno Raposo Prazeres do Carmo,2009
190,,0,B.E.,0,0,1,0,3.48,0,287,Serpa,Beja,0,175,2.12,,False,107,1.3,7,8256,57.17,Maria Manuela Carreiro da Silva Salta,2009
191,,0,CDS-PP,0,0,1,0,1.36,0,112,Serpa,Beja,0,175,2.12,,False,107,1.3,7,8256,57.17,Catarina Salgueiro Ramos Gomes Serrano,2009
192,,4,PCP-PEV,1,1,1,4,51.9,1,4285,Serpa,Beja,0,175,2.12,,False,107,1.3,7,8256,57.17,João Manuel Rocha da Silva,2009
193,,0,PPD/PSD,0,0,1,0,8.58,0,708,Serpa,Beja,0,175,2.12,,False,107,1.3,7,8256,57.17,Sebastião Manuel L. Morgado Louro Rodrigues,2009
194,,3,PS,0,0,1,3,31.27,0,2582,Serpa,Beja,0,175,2.12,,False,107,1.3,7,8256,57.17,António José Patinho Pereira,2009
195,,0,B.E.,0,0,1,0,1.28,0,46,Vidigueira,Beja,0,61,1.7,,False,55,1.53,4,3596,67.44,Fernando António da Silva Servo,2009
196,,0,CDS-PP,0,0,1,0,1.25,0,45,Vidigueira,Beja,0,61,1.7,,False,55,1.53,4,3596,67.44,Maria Micaela Matado Rosa,2009
197,,3,PCP-PEV,1,1,1,3,55.23,1,1986,Vidigueira,Beja,0,61,1.7,,False,55,1.53,4,3596,67.44,Manuel Luís da Rosa Marra,2009
198,,0,PPD/PSD,0,0,1,0,4.87,0,175,Vidigueira,Beja,0,61,1.7,,False,55,1.53,4,3596,67.44,Guido João Diniz Pires,2009
199,,2,PS,0,0,1,2,34.15,0,1228,Vidigueira,Beja,0,61,1.7,,False,55,1.53,4,3596,67.44,António Francisco Cano Mendes Pinto,2009
