,alternateCandidates,mandates,party,presidents,votes.absoluteMajority,votes.constituenctyCounter,votes.mandates,votes.percentage,votes.presidents,votes.votes,county,district,availableMandates,blankVotes,blankVotesPercentage,displayMessage,hasNoVoting,nullVotes,nullVotesPercentage,numberParishes,numberVoters,percentageVoters,candidatos,year
394,,5,PPD/PSD.CDS-PP,1,1,1,5,56.7,1,8404,Montemor-o-Velho,Coimbra,0,261,1.76,,False,180,1.21,14,14821,65.12,Luis Manuel Barbosa Marques Leal,2009
395,,2,PS,0,0,1,2,33.26,0,4930,Montemor-o-Velho,Coimbra,0,261,1.76,,False,180,1.21,14,14821,65.12,Emilio Augusto Ferreira Torrão,2009
396,,3,PS,1,0,1,3,36.11,1,5278,Oliveira do Hospital,Coimbra,0,149,1.02,,False,249,1.7,21,14617,74.95,José Carlos Alexandrino Mendes,2009
397,,0,PCP-PEV,0,0,1,0,0.35,0,12,Pampilhosa da Serra,Coimbra,0,36,1.05,,False,42,1.22,10,3436,72.26,Alfredo João Ventura de Paula Campos,2009
398,,3,PPD/PSD,1,1,1,3,55.88,1,1920,Pampilhosa da Serra,Coimbra,0,36,1.05,,False,42,1.22,10,3436,72.26,José Alberto Pacheco Brito Dias,2009
399,,2,PS,0,0,1,2,41.5,0,1426,Pampilhosa da Serra,Coimbra,0,36,1.05,,False,42,1.22,10,3436,72.26,Antonio Sergio Brito Martins,2009
400,,0,CDS-PP,0,0,1,0,1.83,0,177,Penacova,Coimbra,0,103,1.07,,False,114,1.18,11,9667,63.0,Arsenio José Carvalho dos Santos Abreu,2009
401,,0,PCP-PEV,0,0,1,0,5.5,0,532,Penacova,Coimbra,0,103,1.07,,False,114,1.18,11,9667,63.0,Eduardo da Fonte Ferreira,2009
402,,3,PPD/PSD,0,0,1,3,39.45,0,3814,Penacova,Coimbra,0,103,1.07,,False,114,1.18,11,9667,63.0,Luis Jorge Frias Morgado,2009
403,,4,PS,1,1,1,4,50.97,1,4927,Penacova,Coimbra,0,103,1.07,,False,114,1.18,11,9667,63.0,Humberto José Batista Oliveira,2009
404,,0,PCP-PEV,0,0,1,0,1.47,0,56,Penela,Coimbra,0,85,2.23,,False,56,1.47,6,3807,67.89,Rui Daniel Gonçalves Lopes,2009
405,,3,PPD/PSD,1,1,1,3,62.49,1,2379,Penela,Coimbra,0,85,2.23,,False,56,1.47,6,3807,67.89,Paulo Jorge Simões Julio,2009
406,,2,PS,0,0,1,2,32.34,0,1231,Penela,Coimbra,0,85,2.23,,False,56,1.47,6,3807,67.89,Renato Filipe Nunes França,2009
407,,0,B.E.,0,0,1,0,4.03,0,463,Soure,Coimbra,0,327,2.84,,False,202,1.76,12,11494,60.45,Manuel Augusto Jordão Simões da Silva,2009
408,,0,CDS-PP,0,0,1,0,1.98,0,228,Soure,Coimbra,0,327,2.84,,False,202,1.76,12,11494,60.45,José da Costa Cordeiro Pato,2009
409,,0,PCP-PEV,0,0,1,0,10.27,0,1180,Soure,Coimbra,0,327,2.84,,False,202,1.76,12,11494,60.45,Maria Manuela Lucas Oliveira Santos,2009
410,,2,PPD/PSD,0,0,1,2,25.67,0,2950,Soure,Coimbra,0,327,2.84,,False,202,1.76,12,11494,60.45,Sonia Cristina da Silva Vidal Pires,2009
411,,5,PS,1,1,1,5,53.45,1,6144,Soure,Coimbra,0,327,2.84,,False,202,1.76,12,11494,60.45,João Eduardo Dias Madeira Gouveia,2009
412,,0,PCP-PEV,0,0,1,0,3.53,0,269,Tábua,Coimbra,0,127,1.66,,False,129,1.69,15,7629,70.22,José Antonio Rodrigues Alexandre,2009
413,,3,PPD/PSD.CDS-PP,0,0,1,3,36.75,0,2804,Tábua,Coimbra,0,127,1.66,,False,129,1.69,15,7629,70.22,Jorge Manuel Cova Veigas,2009
414,,4,PS,1,1,1,4,56.36,1,4300,Tábua,Coimbra,0,127,1.66,,False,129,1.69,15,7629,70.22,Francisco Ivo de Lima Portela,2009
415,,0,PCP-PEV,0,0,1,0,3.13,0,119,Vila Nova de Poiares,Coimbra,0,98,2.58,,False,64,1.68,4,3802,60.62,Artur Coimbra dos Reis,2009
416,,3,PPD/PSD,1,1,1,3,56.5,1,2148,Vila Nova de Poiares,Coimbra,0,98,2.58,,False,64,1.68,4,3802,60.62,Jaime Carlos Marta Soares,2009
417,,2,PS,0,0,1,2,36.11,0,1373,Vila Nova de Poiares,Coimbra,0,98,2.58,,False,64,1.68,4,3802,60.62,Joaquim Pires Monteiro,2009
418,,0,B.E.,0,0,1,0,2.98,0,443,Albufeira,Faro,0,239,1.61,,False,145,0.97,5,14886,51.29,Manuel José da Conceição Aires,2009
419,,0,CDS-PP,0,0,1,0,3.06,0,456,Albufeira,Faro,0,239,1.61,,False,145,0.97,5,14886,51.29,Alexandre Manuel Azevedo de Freitas,2009
420,,0,PCP-PEV,0,0,1,0,3.16,0,471,Albufeira,Faro,0,239,1.61,,False,145,0.97,5,14886,51.29,Fernando José Pontes,2009
421,,6,PPD/PSD,1,1,1,6,67.02,1,9977,Albufeira,Faro,0,239,1.61,,False,145,0.97,5,14886,51.29,Desidério Jorge da Silva,2009
422,,1,PS,0,0,1,1,21.19,0,3155,Albufeira,Faro,0,239,1.61,,False,145,0.97,5,14886,51.29,David Martins,2009
423,,0,PCP-PEV,0,0,1,0,2.09,0,51,Alcoutim,Faro,0,24,0.98,,False,45,1.84,5,2442,77.5,Maria Luísa Fernandes,2009
424,,3,PPD/PSD,1,1,1,3,51.56,1,1259,Alcoutim,Faro,0,24,0.98,,False,45,1.84,5,2442,77.5,Francisco Augusto Caimoto Amaral,2009
425,,2,PS,0,0,1,2,43.53,0,1063,Alcoutim,Faro,0,24,0.98,,False,45,1.84,5,2442,77.5,José D'Assunção Pereira Galrito,2009
426,,0,PCP-PEV,0,0,1,0,13.2,0,391,Aljezur,Faro,0,79,2.67,,False,53,1.79,4,2961,66.45,Francisco dos Santos Sérgio,2009
427,,1,PPD/PSD,0,0,1,1,16.31,0,483,Aljezur,Faro,0,79,2.67,,False,53,1.79,4,2961,66.45,Rosa Maria dos Santos Cigarra Rocha,2009
428,,4,PS,1,1,1,4,66.02,1,1955,Aljezur,Faro,0,79,2.67,,False,53,1.79,4,2961,66.45,José Manuel Velhinho Amarelinho,2009
429,,0,CDS-PP,0,0,1,0,1.01,0,43,Castro Marim,Faro,0,49,1.16,,False,51,1.2,4,4241,70.74,Ezequiel do Monte Correia Barragão,2009
430,,0,PCP-PEV,0,0,1,0,2.07,0,88,Castro Marim,Faro,0,49,1.16,,False,51,1.2,4,4241,70.74,Margarida Maria Henriques Martins Mendes,2009
431,,3,PPD/PSD,1,1,1,3,54.37,1,2306,Castro Marim,Faro,0,49,1.16,,False,51,1.2,4,4241,70.74,José Fernandes Estevens,2009
432,,2,PS,0,0,1,2,40.18,0,1704,Castro Marim,Faro,0,49,1.16,,False,51,1.2,4,4241,70.74,Manuel de Almeida Martins,2009
433,,0,B.E.,0,0,1,0,3.04,0,950,Faro,Faro,0,499,1.6,,False,336,1.07,6,31264,57.42,João Carlos Pereira Peres Brandão,2009
434,,0,I,0,0,1,0,4.12,0,1287,Faro,Faro,0,499,1.6,,False,336,1.07,6,31264,57.42,José Adriano Gago Vitorino,2009
435,,0,PCP-PEV,0,0,1,0,5.25,0,1642,Faro,Faro,0,499,1.6,,False,336,1.07,6,31264,57.42,António Manuel Dias Mendonça,2009
436,,5,PPD/PSD.CDS-PP.MPT.PPM,1,1,1,5,42.67,1,13340,Faro,Faro,0,499,1.6,,False,336,1.07,6,31264,57.42,José Macário Custódio Correia,2009
437,,4,PS,0,0,1,4,42.25,0,13210,Faro,Faro,0,499,1.6,,False,336,1.07,6,31264,57.42,José Apolinário Nunes Portada,2009
438,,4,PPD/PSD,1,1,1,4,44.91,1,4603,Lagoa,Faro,0,126,1.23,,False,107,1.04,6,10250,58.39,José Inácio Marques Eduardo,2009
439,,3,PS,0,0,1,3,41.96,0,4301,Lagoa,Faro,0,126,1.23,,False,107,1.04,6,10250,58.39,João Nuno Aurélio Marcos,2009
440,,0,B.E.,0,0,1,0,4.62,0,595,Lagos,Faro,0,269,2.09,,False,121,0.94,6,12891,57.35,Vera Maria de Freitas Faria Gonçalves,2009
441,,0,MPT,0,0,1,0,0.73,0,94,Lagos,Faro,0,269,2.09,,False,121,0.94,6,12891,57.35,João Manuel Martins Evangelista,2009
442,,0,PCP-PEV,0,0,1,0,5.77,0,744,Lagos,Faro,0,269,2.09,,False,121,0.94,6,12891,57.35,Maria Brites Quintino da Silva Nunes Dias Alcobia,2009
443,,2,PPD/PSD.CDS-PP,0,0,1,2,24.92,0,3213,Lagos,Faro,0,269,2.09,,False,121,0.94,6,12891,57.35,Nuno Pedro dos Santos Borges Marques,2009
444,,5,PS,1,1,1,5,60.93,1,7855,Lagos,Faro,0,269,2.09,,False,121,0.94,6,12891,57.35,Júlio José Monteiro Barroso,2009
445,,0,B.E.,0,0,1,0,2.9,0,858,Loulé,Faro,0,505,1.71,,False,360,1.22,11,29588,54.48,Joaquim Manuel Mealha Costa,2009
446,,0,CDS-PP,0,0,1,0,2.64,0,780,Loulé,Faro,0,505,1.71,,False,360,1.22,11,29588,54.48,Francisco José Contreiras Guerreiro,2009
447,,0,PCP-PEV,0,0,1,0,1.92,0,569,Loulé,Faro,0,505,1.71,,False,360,1.22,11,29588,54.48,José Joaquim Dias Coelho,2009
448,,6,PPD/PSD,1,1,1,6,57.0,1,16865,Loulé,Faro,0,505,1.71,,False,360,1.22,11,29588,54.48,Sebastião Francisco Seruca Emídio,2009
449,,3,PS,0,0,1,3,32.62,0,9651,Loulé,Faro,0,505,1.71,,False,360,1.22,11,29588,54.48,Joaquim Manuel dos Santos Vairinhos,2009
450,,0,CDS-PP,0,0,1,0,1.42,0,60,Monchique,Faro,0,75,1.77,,False,53,1.25,3,4239,74.37,Ana Paula Conceição Santos,2009
451,,0,PCP-PEV,0,0,1,0,3.68,0,156,Monchique,Faro,0,75,1.77,,False,53,1.25,3,4239,74.37,José Matias da Conceição Francisco,2009
452,,3,PPD/PSD,1,1,1,3,46.73,1,1981,Monchique,Faro,0,75,1.77,,False,53,1.25,3,4239,74.37,Rui Miguel da Silva André,2009
453,,2,PS,0,0,1,2,45.15,0,1914,Monchique,Faro,0,75,1.77,,False,53,1.25,3,4239,74.37,Carlos Alberto dos Santos Tuta,2009
454,,1,B.E.,0,0,1,1,9.86,0,1666,Olhão,Faro,0,476,2.82,,False,206,1.22,5,16890,47.42,João Manuel Dias Pereira,2009
455,,0,PCP-PEV,0,0,1,0,9.31,0,1572,Olhão,Faro,0,476,2.82,,False,206,1.22,5,16890,47.42,José Marcelino Correia Castanheira,2009
456,,0,PCTP/MRPP,0,0,1,0,1.82,0,308,Olhão,Faro,0,476,2.82,,False,206,1.22,5,16890,47.42,António João Costa Gamboa,2009
457,,2,PPD/PSD.CDS-PP.MPT.PPM,0,0,1,2,29.12,0,4918,Olhão,Faro,0,476,2.82,,False,206,1.22,5,16890,47.42,Eduardo Abundio Martins de Sousa,2009
458,,4,PS,1,1,1,4,45.85,1,7744,Olhão,Faro,0,476,2.82,,False,206,1.22,5,16890,47.42,Francisco José Fernandes Leal,2009
459,,0,B.E.,0,0,1,0,6.31,0,1460,Portimão,Faro,0,447,1.93,,False,210,0.91,3,23155,54.16,João Manuel Duarte Vasconcelos,2009
460,,0,CDS-PP,0,0,1,0,4.31,0,999,Portimão,Faro,0,447,1.93,,False,210,0.91,3,23155,54.16,João Pedro Gonçalves Marques Caetano,2009
461,,0,PCP-PEV,0,0,1,0,5.93,0,1372,Portimão,Faro,0,447,1.93,,False,210,0.91,3,23155,54.16,Rui de Jesus Sacramento,2009
462,,2,PPD/PSD,0,0,1,2,25.13,0,5818,Portimão,Faro,0,447,1.93,,False,210,0.91,3,23155,54.16,José da Conceição Dias dos Santos,2009
463,,5,PS,1,1,1,5,55.49,1,12849,Portimão,Faro,0,447,1.93,,False,210,0.91,3,23155,54.16,Manuel António da Luz,2009
464,,0,B.E.,0,0,1,0,5.88,0,1006,Silves,Faro,0,381,2.23,,False,306,1.79,8,17100,57.22,Carlos Alberto Alexandre Cabrita,2009
465,,1,PCP-PEV,0,0,1,1,18.67,0,3193,Silves,Faro,0,381,2.23,,False,306,1.79,8,17100,57.22,Rosa Cristina Gonçalves da Palma,2009
466,,3,PPD/PSD,1,0,1,3,39.54,1,6761,Silves,Faro,0,381,2.23,,False,306,1.79,8,17100,57.22,Maria Isabel Fernandes da Silva Soares,2009
467,,3,PS,0,0,1,3,31.89,0,5453,Silves,Faro,0,381,2.23,,False,306,1.79,8,17100,57.22,Lisete de Jesus Neves Romão,2009
468,,0,CDS-PP,0,0,1,0,2.03,0,99,São Brás de Alportel,Faro,0,102,2.09,,False,63,1.29,1,4873,55.51,Cláudia Sofia Valente Brália Cavaco,2009
469,,0,PCP-PEV,0,0,1,0,6.16,0,300,São Brás de Alportel,Faro,0,102,2.09,,False,63,1.29,1,4873,55.51,Alberto Francisco do Espírito Santo Fernandes,2009
470,,1,PPD/PSD,0,0,1,1,15.43,0,752,São Brás de Alportel,Faro,0,102,2.09,,False,63,1.29,1,4873,55.51,João Carlos de Mendonça D'Aragão e Moura,2009
471,,4,PS,1,1,1,4,72.99,1,3557,São Brás de Alportel,Faro,0,102,2.09,,False,63,1.29,1,4873,55.51,António Paulo Jacinto Eusébio,2009
472,,0,B.E.,0,0,1,0,2.88,0,415,Tavira,Faro,0,292,2.03,,False,197,1.37,9,14408,63.1,Daniel Florêncio Viegas da Graça,2009
473,,0,CDS-PP,0,0,1,0,2.59,0,373,Tavira,Faro,0,292,2.03,,False,197,1.37,9,14408,63.1,João Afonso da Cunha Rêgo de Carvalho,2009
474,,0,PCP-PEV,0,0,1,0,2.83,0,408,Tavira,Faro,0,292,2.03,,False,197,1.37,9,14408,63.1,Rodrigo Ferreira Aires,2009
475,,3,PPD/PSD,0,0,1,3,42.32,0,6097,Tavira,Faro,0,292,2.03,,False,197,1.37,9,14408,63.1,Rui Manuel Palmilha Amaro,2009
476,,4,PS,1,1,1,4,45.99,1,6626,Tavira,Faro,0,292,2.03,,False,197,1.37,9,14408,63.1,Jorge Manuel do Nascimento Botelho,2009
477,,0,B.E.,0,0,1,0,1.86,0,196,Vila Real de Santo António,Faro,0,94,0.89,,False,94,0.89,3,10540,63.86,António Tomás Rodrigues,2009
478,,0,CDS-PP,0,0,1,0,1.09,0,115,Vila Real de Santo António,Faro,0,94,0.89,,False,94,0.89,3,10540,63.86,Jorge Manuel dos Santos Pinto,2009
479,,0,PCP-PEV,0,0,1,0,7.38,0,778,Vila Real de Santo António,Faro,0,94,0.89,,False,94,0.89,3,10540,63.86,Angelo Miguel Bandeira Barão,2009
480,,6,PPD/PSD,1,1,1,6,71.09,1,7493,Vila Real de Santo António,Faro,0,94,0.89,,False,94,0.89,3,10540,63.86,Luís Filipe Soromenho Gomes,2009
481,,1,PS,0,0,1,1,16.79,0,1770,Vila Real de Santo António,Faro,0,94,0.89,,False,94,0.89,3,10540,63.86,Jovita de Fátima Romano Ladeira,2009
482,,0,MPT,0,0,1,0,0.65,0,20,Vila do Bispo,Faro,0,37,1.21,,False,26,0.85,5,3058,71.42,João Pedro Gonçalves Viegas Jacinto,2009
483,,0,PCP-PEV,0,0,1,0,1.86,0,57,Vila do Bispo,Faro,0,37,1.21,,False,26,0.85,5,3058,71.42,Jorge Alexandre São Pedro Ribeiro Gomes,2009
484,,2,PPD/PSD,0,0,1,2,36.13,0,1105,Vila do Bispo,Faro,0,37,1.21,,False,26,0.85,5,3058,71.42,Gilberto Repolho dos Reis Viegas,2009
485,,2,PS,1,0,1,2,39.6,1,1211,Vila do Bispo,Faro,0,37,1.21,,False,26,0.85,5,3058,71.42,Adelino Augusto da Rocha Soares,2009
486,,1,VI,0,0,1,1,19.69,0,602,Vila do Bispo,Faro,0,37,1.21,,False,26,0.85,5,3058,71.42,José de Deus Vieira Rodrigues,2009
487,,0,CDS-PP,0,0,1,0,6.31,0,274,Aguiar da Beira,Guarda,0,45,1.04,,False,94,2.17,13,4339,65.35,EMILIA DAS NEVES BENTO SILVA,2009
488,,0,PCP-PEV,0,0,1,0,0.92,0,40,Aguiar da Beira,Guarda,0,45,1.04,,False,94,2.17,13,4339,65.35,JOAQUIM AUGUSTO POMBINHO MACAU,2009
489,,3,PPD/PSD,1,1,1,3,51.69,1,2243,Aguiar da Beira,Guarda,0,45,1.04,,False,94,2.17,13,4339,65.35,AUGUSTO FERNANDO ANDRADE,2009
490,,2,PS,0,0,1,2,37.87,0,1643,Aguiar da Beira,Guarda,0,45,1.04,,False,94,2.17,13,4339,65.35,ANTONIO ALBERTO FERREIRA DE LACERDA,2009
491,,0,PCP-PEV,0,0,1,0,1.75,0,104,Almeida,Guarda,0,95,1.59,,False,127,2.13,29,5957,68.49,JOÃO LUIS GONÇALVES DE FRIAS TERREIRO,2009
492,,3,PPD/PSD.CDS-PP,1,1,1,3,52.12,1,3105,Almeida,Guarda,0,95,1.59,,False,127,2.13,29,5957,68.49,ANTÓNIO BAPTISTA RIBEIRO,2009
493,,2,PS,0,0,1,2,42.4,0,2526,Almeida,Guarda,0,95,1.59,,False,127,2.13,29,5957,68.49,ORLINDO BALCÃO VICENTE,2009
494,,1,I,0,0,1,1,22.12,0,1376,Celorico da Beira,Guarda,0,65,1.05,,False,107,1.72,22,6220,69.51,Júlio Manuel dos Santos,2009
495,,0,PCP-PEV,0,0,1,0,0.64,0,40,Celorico da Beira,Guarda,0,65,1.05,,False,107,1.72,22,6220,69.51,José Manuel Lopes Catalino,2009
496,,1,PPD/PSD.CDS-PP,0,0,1,1,21.27,0,1323,Celorico da Beira,Guarda,0,65,1.05,,False,107,1.72,22,6220,69.51,Victor Martins Santos,2009
497,,3,PS,1,1,1,3,53.2,1,3309,Celorico da Beira,Guarda,0,65,1.05,,False,107,1.72,22,6220,69.51,José Francisco Gomes Monteiro,2009
498,,0,PCP-PEV,0,0,1,0,0.88,0,42,Figueira de Castelo Rodrigo,Guarda,0,71,1.48,,False,82,1.71,17,4785,72.7,Maria Graciete Almeida Brito,2009
499,,3,PPD/PSD,1,1,1,3,55.42,1,2652,Figueira de Castelo Rodrigo,Guarda,0,71,1.48,,False,82,1.71,17,4785,72.7,António Edmundo Freire Ribeiro,2009
500,,2,PS,0,0,1,2,40.5,0,1938,Figueira de Castelo Rodrigo,Guarda,0,71,1.48,,False,82,1.71,17,4785,72.7,Carlos Alberto Nunes Panta,2009
501,,0,CDS-PP.PPM,0,0,1,0,3.28,0,130,Fornos de Algodres,Guarda,0,65,1.64,,False,59,1.49,16,3962,71.98,Maria João Albuquerque Pimentel Vasconcelos,2009
502,,0,PCP-PEV,0,0,1,0,0.88,0,35,Fornos de Algodres,Guarda,0,65,1.64,,False,59,1.49,16,3962,71.98,Joaquim Alberto Santos de Almeida,2009
503,,3,PPD/PSD,1,1,1,3,54.67,1,2166,Fornos de Algodres,Guarda,0,65,1.64,,False,59,1.49,16,3962,71.98,José Severino Soares Miranda,2009
504,,2,PS,0,0,1,2,38.04,0,1507,Fornos de Algodres,Guarda,0,65,1.64,,False,59,1.49,16,3962,71.98,António José Elvas da Rocha,2009
505,,0,CDS-PP,0,0,1,0,1.63,0,165,Gouveia,Guarda,0,195,1.92,,False,126,1.24,22,10145,64.72,Nuno Filipe Menezes Simões,2009
506,,0,PCP-PEV,0,0,1,0,3.39,0,344,Gouveia,Guarda,0,195,1.92,,False,126,1.24,22,10145,64.72,Nuno Ricardo Dinis de Abreu,2009
507,,4,PPD/PSD,1,1,1,4,52.08,1,5284,Gouveia,Guarda,0,195,1.92,,False,126,1.24,22,10145,64.72,Álvaro dos Santos Amaro,2009
508,,3,PS,0,0,1,3,39.73,0,4031,Gouveia,Guarda,0,195,1.92,,False,126,1.24,22,10145,64.72,Armando José dos Santos Almeida,2009
509,,0,B.E.,0,0,1,0,2.89,0,723,Guarda,Guarda,0,579,2.31,,False,539,2.15,55,25053,62.72,Jorge Manuel da Cunha Coutinho Noutel,2009
510,,0,CDS-PP,0,0,1,0,5.15,0,1291,Guarda,Guarda,0,579,2.31,,False,539,2.15,55,25053,62.72,Cláudia Maria Amaral Teixeira,2009
511,,0,PCP-PEV,0,0,1,0,2.68,0,672,Guarda,Guarda,0,579,2.31,,False,539,2.15,55,25053,62.72,Honorato Gil Robalo,2009
512,,0,PCTP/MRPP,0,0,1,0,0.7,0,176,Guarda,Guarda,0,579,2.31,,False,539,2.15,55,25053,62.72,Eduardo Pires do Espírito Santo,2009
513,,2,PPD/PSD,0,0,1,2,28.33,0,7097,Guarda,Guarda,0,579,2.31,,False,539,2.15,55,25053,62.72,José Luís Monteiro Crespo de Carvalho,2009
514,,5,PS,1,1,1,5,55.79,1,13976,Guarda,Guarda,0,579,2.31,,False,539,2.15,55,25053,62.72,Joaquim Carlos Dias Valente,2009
515,,0,PCP-PEV,0,0,1,0,2.3,0,64,Manteigas,Guarda,0,33,1.19,,False,34,1.22,4,2777,71.3,José Maria Serra  Saraiva,2009
516,,2,PPD/PSD,0,0,1,2,41.27,0,1146,Manteigas,Guarda,0,33,1.19,,False,34,1.22,4,2777,71.3,José Manuel Custódia Biscaia,2009
517,,3,PS,1,1,1,3,54.02,1,1500,Manteigas,Guarda,0,33,1.19,,False,34,1.22,4,2777,71.3,Esmeraldo Saraiva Neto Carvalhinho,2009
518,,0,PCP-PEV,0,0,1,0,1.2,0,53,Meda,Guarda,0,51,1.15,,False,76,1.71,16,4435,68.74,Manuel de Jesus Darei Frade,2009
519,,2,PPD/PSD,0,0,1,2,42.57,0,1888,Meda,Guarda,0,51,1.15,,False,76,1.71,16,4435,68.74,João Germano Mourato Leal Pinto,2009
520,,3,PS,1,1,1,3,53.37,1,2367,Meda,Guarda,0,51,1.15,,False,76,1.71,16,4435,68.74,Armando Luis Rodrigues Carneiro,2009
521,,0,CDS-PP,0,0,1,0,3.42,0,247,Pinhel,Guarda,0,135,1.87,,False,121,1.68,27,7213,64.26,Pedro Francisco de Campos Henriques Albuquerque,2009
522,,0,PCP-PEV,0,0,1,0,2.27,0,164,Pinhel,Guarda,0,135,1.87,,False,121,1.68,27,7213,64.26,Joaquim Luis Ferreira,2009
523,,5,PPD/PSD,1,1,1,5,59.98,1,4326,Pinhel,Guarda,0,135,1.87,,False,121,1.68,27,7213,64.26,António Luis Monteiro Ruas,2009
524,,2,PS,0,0,1,2,30.78,0,2220,Pinhel,Guarda,0,135,1.87,,False,121,1.68,27,7213,64.26,Rui Manuel de Oliveira Campos Teixeira,2009
525,,0,CDS-PP,0,0,1,0,2.18,0,212,Sabugal,Guarda,0,166,1.71,,False,190,1.95,40,9728,59.6,Ana Isabel Lasso de La Vega e Charters Amaral Marques,2009
526,,1,MPT,0,0,1,1,18.31,0,1781,Sabugal,Guarda,0,166,1.71,,False,190,1.95,40,9728,59.6,Joaquim Fernando Ricardo,2009
527,,0,PCP-PEV,0,0,1,0,0.99,0,96,Sabugal,Guarda,0,166,1.71,,False,190,1.95,40,9728,59.6,José Manuel Monteiro,2009
528,,3,PPD/PSD,1,0,1,3,38.9,1,3784,Sabugal,Guarda,0,166,1.71,,False,190,1.95,40,9728,59.6,António dos Santos Robalo,2009
529,,3,PS,0,0,1,3,35.97,0,3499,Sabugal,Guarda,0,166,1.71,,False,190,1.95,40,9728,59.6,António Bernardo Morgado Gomes Dionísio,2009
530,,0,PCP-PEV,0,0,1,0,5.66,0,918,Seia,Guarda,0,351,2.16,,False,251,1.55,29,16229,62.73,António da Silva Abrantes,2009
531,,3,PPD/PSD.CDS-PP,0,0,1,3,38.44,0,6239,Seia,Guarda,0,351,2.16,,False,251,1.55,29,16229,62.73,Luis Jorge da Silva Caetano,2009
532,,4,PS,1,1,1,4,52.19,1,8470,Seia,Guarda,0,351,2.16,,False,251,1.55,29,16229,62.73,CARLOS FILIPE CAMELO MIRANDA DE FIGUEIREDO,2009
533,,0,PCP-PEV,0,0,1,0,1.06,0,77,Trancoso,Guarda,0,117,1.61,,False,121,1.67,29,7249,65.29,Armando  da Conceição Morais de Oliveira,2009
534,,4,PPD/PSD,1,1,1,4,50.43,1,3656,Trancoso,Guarda,0,117,1.61,,False,121,1.67,29,7249,65.29,Júlio José Saraiva Sarmento,2009
535,,3,PS,0,0,1,3,45.22,0,3278,Trancoso,Guarda,0,117,1.61,,False,121,1.67,29,7249,65.29,Amilcar José Nunes Salvador,2009
536,,0,CDS-PP,0,0,1,0,1.13,0,68,Vila Nova de Foz Côa,Guarda,0,80,1.32,,False,79,1.31,17,6040,68.69,Luis Arnaldo Batista Ramalho,2009
537,,0,PCP-PEV,0,0,1,0,1.39,0,84,Vila Nova de Foz Côa,Guarda,0,80,1.32,,False,79,1.31,17,6040,68.69,Luis Manuel Branquinho Pinto,2009
538,,3,PPD/PSD,1,1,1,3,48.53,1,2931,Vila Nova de Foz Côa,Guarda,0,80,1.32,,False,79,1.31,17,6040,68.69,Gustavo Sousa Duarte,2009
539,,2,PS,0,0,1,2,46.32,0,2798,Vila Nova de Foz Côa,Guarda,0,80,1.32,,False,79,1.31,17,6040,68.69,Emilio António Pessoa Mesquita,2009
540,,0,B.E.,0,0,1,0,2.6,0,775,Alcobaça,Leiria,0,851,2.85,,False,469,1.57,18,29824,60.43,Adelino António Moreira Granja,2009
541,,0,CDS-PP,0,0,1,0,5.2,0,1551,Alcobaça,Leiria,0,851,2.85,,False,469,1.57,18,29824,60.43,Jorge Manuel Saraiva Esteves de Carvalho,2009
542,,0,III,0,0,1,0,6.67,0,1988,Alcobaça,Leiria,0,851,2.85,,False,469,1.57,18,29824,60.43,José Carvalho Pedrosa,2009
543,,1,PCP-PEV,0,0,1,1,15.28,0,4558,Alcobaça,Leiria,0,851,2.85,,False,469,1.57,18,29824,60.43,Rogério Manuel Madeira Raimundo,2009
544,,4,PPD/PSD,1,1,1,4,44.93,1,13401,Alcobaça,Leiria,0,851,2.85,,False,469,1.57,18,29824,60.43,Paulo Jorge Marques Inácio,2009
545,,2,PS,0,0,1,2,20.89,0,6231,Alcobaça,Leiria,0,851,2.85,,False,469,1.57,18,29824,60.43,José Acácio Paulino Barbosa,2009
546,,1,CDS-PP,0,0,1,1,22.35,0,1074,Alvaiázere,Leiria,0,71,1.48,,False,64,1.33,7,4805,64.67,Abel Marques dos Reis Nunes,2009
547,,0,PCP-PEV,0,0,1,0,0.92,0,44,Alvaiázere,Leiria,0,71,1.48,,False,64,1.33,7,4805,64.67,João Paulo Forte Pires,2009
548,,3,PPD/PSD,1,1,1,3,50.72,1,2437,Alvaiázere,Leiria,0,71,1.48,,False,64,1.33,7,4805,64.67,Paulo Tito Delgado Morgado,2009
549,,1,PS,0,0,1,1,23.2,0,1115,Alvaiázere,Leiria,0,71,1.48,,False,64,1.33,7,4805,64.67,Maria Teodora Freire Gonçalves Cardo,2009
550,,0,PCP-PEV,0,0,1,0,2.41,0,195,Ansião,Leiria,0,114,1.41,,False,77,0.95,8,8075,63.84,Nidia Maria Coutinho e Valente,2009
551,,5,PPD/PSD,1,1,1,5,62.58,1,5053,Ansião,Leiria,0,114,1.41,,False,77,0.95,8,8075,63.84,Rui Alexandre Novo e Rocha,2009
552,,2,PS,0,0,1,2,32.64,0,2636,Ansião,Leiria,0,114,1.41,,False,77,0.95,8,8075,63.84,António Jose Vicente Domingues,2009
553,,1,CDS-PP,0,0,1,1,11.97,0,1001,Batalha,Leiria,0,192,2.3,,False,139,1.66,4,8365,61.53,Horácio Moita Francisco,2009
554,,0,PCP-PEV,0,0,1,0,1.69,0,141,Batalha,Leiria,0,192,2.3,,False,139,1.66,4,8365,61.53,José Joaquim Filipe Valentim,2009
555,,5,PPD/PSD,1,1,1,5,68.26,1,5710,Batalha,Leiria,0,192,2.3,,False,139,1.66,4,8365,61.53,António José Martins de Sousa Lucas,2009
556,,1,PS,0,0,1,1,14.13,0,1182,Batalha,Leiria,0,192,2.3,,False,139,1.66,4,8365,61.53,Francisco José Meireles Cardoso,2009
557,,0,CDS-PP,0,0,1,0,6.26,0,444,Bombarral,Leiria,0,118,1.66,,False,89,1.26,5,7090,57.39,João Carlos Vieira Comparada,2009
558,,0,PCP-PEV,0,0,1,0,6.39,0,453,Bombarral,Leiria,0,118,1.66,,False,89,1.26,5,7090,57.39,José Agostinho Faria,2009
559,,4,PPD/PSD,1,1,1,4,49.89,1,3537,Bombarral,Leiria,0,118,1.66,,False,89,1.26,5,7090,57.39,José Manuel Gonçalves Vieira,2009
560,,3,PS,0,0,1,3,34.54,0,2449,Bombarral,Leiria,0,118,1.66,,False,89,1.26,5,7090,57.39,Jorge Gabriel Duarte Catana Martins,2009
561,,0,B.E.,0,0,1,0,4.87,0,1075,Caldas da Rainha,Leiria,0,601,2.73,,False,264,1.2,16,22052,50.75,Rui Manuel dos Santos Calisto,2009
562,,1,CDS-PP,0,0,1,1,11.11,0,2449,Caldas da Rainha,Leiria,0,601,2.73,,False,264,1.2,16,22052,50.75,Manuel Fialho Isaque,2009
563,,0,PCP-PEV,0,0,1,0,4.15,0,915,Caldas da Rainha,Leiria,0,601,2.73,,False,264,1.2,16,22052,50.75,António Henriques Barros,2009
564,,4,PPD/PSD,1,1,1,4,50.47,1,11130,Caldas da Rainha,Leiria,0,601,2.73,,False,264,1.2,16,22052,50.75,Fernando José da Costa,2009
565,,2,PS,0,0,1,2,25.48,0,5618,Caldas da Rainha,Leiria,0,601,2.73,,False,264,1.2,16,22052,50.75,Delfim Marques de Azevedo,2009
566,,0,PCP-PEV,0,0,1,0,2.36,0,51,Castanheira de Pêra,Leiria,0,69,3.19,,False,33,1.52,2,2164,66.44,Manuel Lopes da Costa,2009
567,,2,PPD/PSD,0,0,1,2,43.81,0,948,Castanheira de Pêra,Leiria,0,69,3.19,,False,33,1.52,2,2164,66.44,Pedro Manuel Alves da Graça,2009
568,,3,PS,1,1,1,3,49.12,1,1063,Castanheira de Pêra,Leiria,0,69,3.19,,False,33,1.52,2,2164,66.44,Fernando José Pires Lopes,2009
569,,0,PCP-PEV,0,0,1,0,1.11,0,53,Figueiró dos Vinhos,Leiria,0,77,1.61,,False,58,1.21,5,4792,73.37,Maria Celeste Miranda Ferreira Morgado,2009
570,,3,PPD/PSD,1,1,1,3,55.38,1,2654,Figueiró dos Vinhos,Leiria,0,77,1.61,,False,58,1.21,5,4792,73.37,Rui Manuel de Almeida e Silva,2009
571,,2,PS,0,0,1,2,40.69,0,1950,Figueiró dos Vinhos,Leiria,0,77,1.61,,False,58,1.21,5,4792,73.37,Carlos Alberto David dos Santos Lopes,2009
572,,0,B.E.,0,0,1,0,3.35,0,2199,Leiria,Leiria,0,1804,2.75,,False,860,1.31,29,65648,59.44,José Manuel Peixoto Figueira Henriques,2009
573,,1,CDS-PP,0,0,1,1,7.68,0,5043,Leiria,Leiria,0,1804,2.75,,False,860,1.31,29,65648,59.44,António Carlos Batista Martinho Gomes,2009
574,,0,PCP-PEV,0,0,1,0,2.44,0,1600,Leiria,Leiria,0,1804,2.75,,False,860,1.31,29,65648,59.44,Mário Fernando Brites Lopes,2009
575,,5,PPD/PSD,0,0,1,5,37.61,0,24693,Leiria,Leiria,0,1804,2.75,,False,860,1.31,29,65648,59.44,Isabel Damasceno Vieira de Campos Costa,2009
576,,5,PS,1,0,1,5,44.86,1,29449,Leiria,Leiria,0,1804,2.75,,False,860,1.31,29,65648,59.44,Raúl Miguel de Castro,2009
577,,0,B.E.,0,0,1,0,5.67,0,1017,Marinha Grande,Leiria,0,378,2.11,,False,216,1.21,3,17921,55.21,Amândio João Paula Fernandes,2009
578,,0,I,0,0,1,0,5.8,0,1039,Marinha Grande,Leiria,0,378,2.11,,False,216,1.21,3,17921,55.21,Artur Pereira de Oliveira,2009
579,,3,PCP-PEV,0,0,1,3,31.43,0,5632,Marinha Grande,Leiria,0,378,2.11,,False,216,1.21,3,17921,55.21,Alberto Filomeno Esteves Cascalho,2009
580,,1,PPD/PSD,0,0,1,1,17.7,0,3172,Marinha Grande,Leiria,0,378,2.11,,False,216,1.21,3,17921,55.21,António Manuel Jesus Ferreira Santos,2009
581,,3,PS,1,0,1,3,36.09,1,6467,Marinha Grande,Leiria,0,378,2.11,,False,216,1.21,3,17921,55.21,Álvaro Manuel Marques Pereira,2009
582,,0,PCP-PEV,0,0,1,0,5.36,0,428,Nazaré,Leiria,0,173,2.17,,False,100,1.25,3,7988,56.03,João Paulo Quinzico Delgado,2009
583,,4,PPD/PSD,1,1,1,4,48.03,1,3837,Nazaré,Leiria,0,173,2.17,,False,100,1.25,3,7988,56.03,Jorge Codinha Antunes Barroso,2009
584,,3,PS,0,0,1,3,35.77,0,2857,Nazaré,Leiria,0,173,2.17,,False,100,1.25,3,7988,56.03,Vitor Manuel Estrelinha Esgaio,2009
585,,0,PCP-PEV,0,0,1,0,1.84,0,46,Pedrógão Grande,Leiria,0,98,3.91,,False,52,2.08,3,2506,63.64,Rui Baltazar Coelho da Silva Matias,2009
586,,4,PPD/PSD,1,1,1,4,68.44,1,1715,Pedrógão Grande,Leiria,0,98,3.91,,False,52,2.08,3,2506,63.64,João Manuel Gomes Marques,2009
587,,1,PS,0,0,1,1,23.74,0,595,Pedrógão Grande,Leiria,0,98,3.91,,False,52,2.08,3,2506,63.64,Paulo Alexandre de Carvalho e Silva,2009
588,,0,B.E.,0,0,1,0,1.88,0,251,Peniche,Leiria,0,266,1.99,,False,189,1.42,6,13355,53.47,Fernando Lino Barradas Franco,2009
589,,0,CDS-PP,0,0,1,0,2.44,0,326,Peniche,Leiria,0,266,1.99,,False,189,1.42,6,13355,53.47,Pedro Silva Formozinho Sanchez,2009
590,,4,PCP-PEV,1,1,1,4,44.08,1,5887,Peniche,Leiria,0,266,1.99,,False,189,1.42,6,13355,53.47,António José Ferreira Sousa Carreira Santos,2009
591,,2,PPD/PSD,0,0,1,2,29.03,0,3877,Peniche,Leiria,0,266,1.99,,False,189,1.42,6,13355,53.47,Luís Lourenço Jorge Ganhão,2009
592,,1,PS,0,0,1,1,19.16,0,2559,Peniche,Leiria,0,266,1.99,,False,189,1.42,6,13355,53.47,Carlos Jorge Gonçalves do Amaral Domingos,2009
593,,0,B.E.,0,0,1,0,1.85,0,504,Pombal,Leiria,0,741,2.71,,False,356,1.3,17,27316,49.81,Agostinho de Barros da Silva,2009
